{
  "schemaVersion": 1,
  "id": "oh-my-theme",
  "displayName": "Oh My Theme",
  "author": "Oh My Theme",
  "source": {
    "type": "generated",
    "url": "https://github.com/abdullahnettoor/ohmytheme",
    "revision": "b5339d1",
    "license": "Not applicable — generated by Oh My Theme",
    "attribution": "Generated by Oh My Theme from its reviewed semantic-role model."
  },
  "variants": [
    {
      "id": "aurora",
      "displayName": "Aurora",
      "appearance": "dark",
      "contentDigest": "sha256:fbc114011547d7485b60cecdd03bb4984dc59f94ef6b9f1e36cab235e0d161d9",
      "roles": {
        "canvas": "#10151f",
        "primary-text": "#e5eefc",
        "secondary-text": "#b5c1d5",
        "surface": "#1b2433",
        "overlay": "#536178",
        "selection": "#28364d",
        "accent": "#8ec5ff",
        "ansi-black": "#28364d",
        "ansi-red": "#ffb4ab",
        "ansi-green": "#a7dca0",
        "ansi-yellow": "#f5d28f",
        "ansi-blue": "#8ec5ff",
        "ansi-magenta": "#d8b4fe",
        "ansi-cyan": "#8be0e8",
        "ansi-white": "#c7d2e3",
        "syntax-comment": "#7e8da6",
        "syntax-keyword": "#d8b4fe",
        "syntax-string": "#a7dca0"
      }
    }
  ]
}
